,id,suggestion,author,date_created,last_upvoted,comments,votes,Description
0,161005,See who i have liked,Moses,"19 Feb, 2021",today,72,1000,A feature that allows you to see a queue of users that you have swiped up on so that you can send notes and revisit.
1,161962,Last onlinerecently active,Moses,"22 Feb, 2021",today,46,507,"A feature that allows you to see how active a user is (e.g., last online 4 hours ago)."
2,164928,Filter church activity,Moses,"01 Mar, 2021",today,41,444,The current options we are thinking of are: Not a memberNot activeLess activeActiveAll in Do you think you have a better option list? Should this be optional or mandatory? Share a comment!
3,177816,Skip a profile save for later,Brian,"11 Apr, 2021",today,35,365,"A feature to let you skip a profile and have it come up again later. Sometimes the swiping can be a little indecisive and it would be cool to have an option that isn't as absolute as a down-swipe. (It could even work similar to the Notes feature, that you can only skip a certain number of profiles in a day or something, or more often for the paid version of the app). It would also make navigating the ""See Who Likes Me"" section much easier."
4,161959,Filter children,Moses,"22 Feb, 2021",today,21,240,Filter users based on if they have children or not.
5,161947,Filter interest level,Moses,"22 Feb, 2021",today,36,226,"Currently, we allow you to scale your dating interest level... (e.g., Into Dating I guess, Seeking Friends, Up for Ice Cream, Down for Dates, Up for Dancing!, Looking for Fun, Down for Sweet Dates, Looking for Romance, Seeking a Relationship, Read for a Ring). Cut the chase and filter those who have the same interest level as you do."
6,296565,Remove swipe limit,Sheppard,30 Apr,today,35,199,"As someone who doesn't get tons of matches, it is heart breaking to see and get a limit on swiping. I don't want to pay to increase my chances of matching with someone. Please remove the swipe limit. I'd rather run out of swipes then get told I can't swipe anymore today."
7,169459,Voice messaging,Johnson Daniel Kalu,"15 Mar, 2021",today,11,172,"Use voice notes in addition to typing, makes chatting more engaging and convenient for users."
8,165044,Neighboring countries filter,Erik,"02 Mar, 2021",yesterday,13,124,"Add the filter for ' neighboring countries'. For all us that don't live in the US this feauture would really help and do expand ones search area that's still somewhat close to you, with out going to 'world wide' search."
9,176350,Display full name,KH,"05 Apr, 2021",08 Jul,20,58,"Like Hinge, make it so that if you provide a last name on your profile, it will be shared with users you match with."
10,253422,Description first optionally,Jackson,"03 Dec, 2021",08 Jul,0,29,"Have an option to have the description appear first and then tap to see the pictures. I don't want to use Mutual anymore because I feel it is reinforcing my bad habit of objectifying people and deciding my interest in them primarily based on their looks, and that makes me feel gross. I think switching it so the photos don't appear until you tap, or at least having the option to set it that way if you want, would help."
11,168489,Let queer members match with other queer members,Rachel,"10 Mar, 2021",today,87,1000,"There are so many queer lds members that are trying their best to be happy and still be active in the church and not be suicidal. Many of us are trying to find someone who supports our efforts to keep going to church in this church because we love it and we don't want to leave it. We want to feel welcomed and loved there, and it would be easier to find a path to happiness and also activity in the church if we could meet other queer Mormons."
12,170983,Watch an ad to see a person who likes you,Anonymous,"19 Mar, 2021",today,25,467,"You have ads that pop up occasionally  anyway, and the ""watch an ad to undo"" feature. Having the option to watch an ad to see who likes you would give people a bit more freedom on the app. You could also limit it to something like three ads in a twenty-four hour period."
13,165279,Birthday surprise,Jefferson Glenn,"02 Mar, 2021",yesterday,9,245,"On the Mutual user's birthday, they will be upgraded to MutualUp (premium features) for 24 hours as a birthday gift from Mutual!"
14,157427,Video chat,Moses,"03 Feb, 2021",08 Jul,21,180,Add the video chat feature so users can video chat with each other.
15,161000,Dark mode,Moses,"19 Feb, 2021",yesterday,9,171,Light-on-dark color scheme. This color scheme uses light-colored text and icons on a dark background.
16,161961,Conversation prompts,Moses,"22 Feb, 2021",09 Jul,24,162,"It would be nice to have different conversation starters to help you break the ice when matching with another user (e.g., two truths and a lie, best discovery: Netflix or Avocados? etc.)."
17,164962,Hide inactive profiles,Dallin,"02 Mar, 2021",today,2,162,"Profiles that are inactive are hidden after an amount of time. This way when you review those that have liked you, if they haven't been active due to ""they got married or are in a relationship now"" and forgot to delete/ deactivate their profile,  you won't be matching with them and not hearing back from those that are no long available."
18,165319,Higher character count in bio,Qaseem,"02 Mar, 2021",09 Jul,17,148,Increase the current character count by 150-200 characters when typing a bio.
19,164933,Filter temple recommend,Moses,"01 Mar, 2021",today,12,141,Filter through users who have a current temple recommend or not.
20,161963,Filter politics,Moses,"22 Feb, 2021",today,19,135,"Republican, Democrat, Libertarian, other?"
21,164926,Share a profile,Moses,"01 Mar, 2021",today,21,132,"Generate a link you can send to a friend that will allow them to see a profile that you saw on mutual. Maybe this isn't your match, but it could be theirs!"
22,175881,Free trial,Erica,"01 Apr, 2021",2 days ago,25,129,do a promo or let us watch adds to have a 24 hour trial of the unlimited version  versus having to commit for a week
23,165329,Increase photo count,Qaseem Maajid-Bey,"02 Mar, 2021",today,3,119,Increase the number of photos on user profiles from 5 to 7
24,176355,When reporting someone there should be an option to upload screenshots,KH,"05 Apr, 2021",today,3,115,"I had to report someone who had sent me sexually explicit gifs and messages, and someone else who had asked for money. It would help to have an option to upload at least one screenshot as proof. Also a little more character space to describe the reason for reporting creeps."
25,161966,Filter divorced,Moses,"22 Feb, 2021",today,25,111,"Allow users to specify on their profile that they are divorced, and make this a filterable attribute on their profile.  Question: If we have options for ""divorced"" or ""widowed"", should there also be an option for ""never married""?"
26,165991,Search by name,Morgan,"03 Mar, 2021",2 days ago,15,111,I'm friends with a lot of husband material guys but both of us are too scared to make a move. They never show up in my feed so it would be nice to search by his name then send him a cute message.
27,170628,Match explanations,Aidan Nemelka,"18 Mar, 2021",09 Jul,3,100,"To help focus on quality instead of quantity, there should be more to it than a mere swipe. Maybe each individual match should be given an idea of where to continue through tags, or a slider like the interest one. They want to talk, they want to go on a date, they think you are attractive, they want to hang out, they want to have fun, grab ice cream, stuff like that... The interest slider doesn't help much. It should be more individual for each match."
28,174999,Allow short videos to be added to profile,Jeannine,"30 Mar, 2021",09 Jul,23,96,(Hinge also does this and this allows you to see more of someone's personality and hear their voice)
29,165068,Age corrections,Meg,"02 Mar, 2021",2 days ago,3,92,I wish the app would stop showing my age a year older just because the year switches. Starting Jan 2021 it shows I'm 29 but I'm still 28 for 6 more months. It should switch your age on your birthday or at least birthday month. I may be filtered out of some searches now.
30,170306,Profile analytics,Robert,"17 Mar, 2021",2 days ago,13,91,"How many people you have swiped on, and percentage swiped up on, in a certain time period or over the lifetime of your profile."
31,179902,Mutual games,Joe,"17 Apr, 2021",yesterday,10,84,Integrate fun little online games to play with your new match.  Games to get to know each other and games to just have a little fun together.  Perhaps Church themed trivia if you must.
32,165005,Share photos send photos in chat,Ejkl,"02 Mar, 2021",today,11,82,During a conversation with a person you should be able to send him a picture.
33,172181,Filter those that like you,Collin,"21 Mar, 2021",2 days ago,6,80,Filter the people that like you in the distance you set instead of showing everyone around the world
34,169249,Video call speed dating,Anonymous,"13 Mar, 2021",09 Jul,11,75,Other apps have this where a few times a week there is a 15min interval where insterested people sign in and get a random date for 3min. Then you can swipe on the person. This could even be a feature for only paying members (or you could have only guys pay for it). I'd totally pay for something like this.
35,176175,Dealbreakers,Damian,"03 Apr, 2021",2 days ago,8,75,"There should be an option for a 'dealbreaker' in the filters. Where they may choose to not have anyone below or above their chosen age, height, or distance filters by selecting the dealbreaker option. On the other hand, they may choose to leave the dealbreaker open and have greater chances for a match."
36,172738,Show likelyhood to respond,Josh,"23 Mar, 2021",2 days ago,8,74,Show me the percentage of how many people someone ignores so I dont seipenup on a ghoster
37,169296,Filter weight,Pedro,"14 Mar, 2021",today,18,69,"If height can be a filter, then weight should be one too."
38,169448,Change unmatch reasons,Nate,"15 Mar, 2021",2 days ago,7,68,"One change I would like would be: Unmatch - without a reason I'd love to be able to unmatch without picking a reason to unmatch. Ie We went on a date and the chemistry wasn't there. Currently, the options all are like ""inappropriate bio, poor offline behavior, etc.... So I don't want to pick that if it was just a lack of chemistry. I also prefer to keep a smaller list of matches. If it's not going to work out, I don't want to see them in my matches"
39,171625,An are you dating someone thing,Mathieu Brewer,"20 Mar, 2021",2 days ago,4,63,I've matched w too many girls who have a bf that are 'just looking for friends' and it's annoying tbh
40,170905,Penalize ignoring a message from a match,Daniel,"18 Mar, 2021",yesterday,17,61,"One of the worst things about Mutual is matching with someone, sending that person a thoughtful message, and then getting ignored. Unfortunately, this happens far too often. Possible remedies:1) Each person has a queue of, say, 5 waiting messages. Each message must be either responded to or the match removed. Once the queue is full, all new matches will be hidden. If someone removes too many matches, his/her ability to swipe is temporarily revoked.2) If someone ignores more than, say, 50% of new match messages, he/she will be forced to initiate conversations or lose the ability to see new profiles. The danger, of course, is that the system would be easy to game. Somehow each person should be incentivized to make meaningful connections, not try to rack up matches to ignore."
41,164958,Nudges or reminders,Sarah,"02 Mar, 2021",2 days ago,2,60,Reminders for people you've matched that the matches are about to expire. It should send notifications/reminders to send them a message.
42,175785,Bring back old matches,Greg,"01 Apr, 2021",08 Jul,3,56,Be able to see people you matched with in the past to retry.
43,172670,Show approximate number of people in range,Robert,"17 Mar, 2021",2 days ago,2,56,"Show how many men and how many women use mutual in a selected range, can be approximate."
44,170894,Filter specific tag,Sanford Bassett,"18 Mar, 2021",08 Jul,61,54,The ability to see people with a specific tag (even a custom tag) would be an excellent addition.
45,179921,Notes should be one per day anytime i want to use it not once every 24 hrs exact,Eliot,"18 Apr, 2021",08 Jul,4,54,"It could be by date change for example not by how many hours have passed since the last time you used a note. For instance, if I use a note at 1030 p.m. on Monday night and for whatever reason want to send another at 1210 a.m. Tuesday I should be able to do that."
46,184861,List view of people whove liked you,Anonymous,"12 May, 2021",yesterday,7,47,Rather than having to go one by one of those who've liked you being able to view in a list similar to bumble would be great!
47,170233,Group date feature,Jaden,"16 Mar, 2021",07 Jul,6,43,"I'm not entirely sure how this would work. I think an option when creating a profile could be to create a group profile. I know people already do this, but making it easier for people would encourage more group profiles. Then it would encourage group dates, which would relieve a lot of the pressure on dating. And it would make mutual safer for all."
48,172119,A notification sound,Bradley,"21 Mar, 2021",08 Jul,2,43,"Whenever I'm outside of the app, I don't notice notifications for sometimes hours, because my phone doesn't vibrate, and no sound goes off, until I turn my screen on and see that the notification is there"
49,161964,Filter pets,Moses,"22 Feb, 2021",07 Jul,1,42,"Pets can be a must or a deal-breaker for certain people. Allow users to specify on their profile that they have or want pets, and make this a filterable attribute on their profile."
50,176262,Add additional location filter by state,Ryan,"04 Apr, 2021",yesterday,5,39,"I'd like to filter the search by state. See everyone in Nevada or Texas, etc."
51,180047,Not for me instead of no reason,Kay,"19 Apr, 2021",08 Jul,1,38,"It's such a small thing, but it bugs me every single time. Of course I have a reason for unmatching with someone. And it's not any of those other suggestions. Inappropriate behavior isn't the only reason to move on from someone. I simply wish to discontinue my correspondence with that person. Why does that need to fall under the 'Other' category?"
52,174225,Time stamps,emma,"27 Mar, 2021",08 Jul,3,37,Adding time stamps for each message in a chat would be helpful (I.e. swiping messages to the left to see what time they were sent at)
53,197289,Ghosting ratio,Sunny,"10 Jul, 2021",09 Jul,2,36,"Ghosting isn't the worst but it isn't the best. Have a button for people to report ghosting, ask if their sure, and have the app verify there has been no response for a month or so, then report their statistics on their profile. Get rid of people who chronically ghost others ( >75%)"
54,184344,Picture upload zoom issue,Daniel,"09 May, 2021",08 Jul,6,35,"Change mutual feature to stop uploading pictures automatically zoomed in really far. Every time I add a picture it's super zoomed in, would prefer people to see more of me and surroundings"
55,164998,Filter ethnicity,B,"02 Mar, 2021",today,14,33,
56,165040,Add spotify top artists,Moses,"02 Mar, 2021",09 Jul,4,30,
57,203487,When ward hopping have option to display both real and hopped location,Matt Eden,"17 Aug, 2021",2 days ago,2,29,"It would be nice for the search function to also work from both locations, as the people you are shown have to have your location/statistics within their preferences.  Having both locations displayed would mean you wouldn't have to explain that you dont actually love there."
58,200161,Filter language,Paige,"27 Jul, 2021",08 Jul,13,27,"Filter based on languages. If I only speak English, and a guy doesn't speak English at all, (or vice versa) then it would obviously not be a good match.  For example, users input whatever languages they speak, and then only users with at least one language in common show up as potential matches."
59,190177,See who liked me list view,Michael Patterson,"09 Jun, 2021",yesterday,8,27,"Rather than have a queue of people who liked you, have a list view that allows you to scroll through and like anybody who liked you. This allows you to browse your list without having to make a decision right away and makes it easier to have the conversations you want to have first."
60,183909,Show new people by most compatible first,Laura,"07 May, 2021",09 Jul,2,27,"Instead of showing new people according to random order or by who is closest, show the people with highest compatibility first (those with similar tags, interest level, etc)"
61,190702,Willing to relocate,mark Osborn,"11 Jun, 2021",09 Jul,3,26,Would be nice to know if someone in a different country/state is willing to relocate to my country/state if we hit it off
62,202492,Make the about me section a required field,Moses Lotulelei,"10 Aug, 2021",08 Jul,2,25,"This encourages higher quality profiles which lead to more meaningful conversations. If someone does not write an about me, it's hard to find conversation starters based solely on their pics."
63,164931,Filter favorite school,Moses,"01 Mar, 2021",07 Jul,23,24,"Filter through current students/alumni or other users who have a favorite university (e.g. BYU, U of U, Utah State, UVU, etc.)."
64,192803,Friends only section,Adam fox,"19 Jun, 2021",yesterday,14,24,"Used specifically for people just looking for friends, similar to bumble BFF feature. Looking for some homies so this would include dudes seeing other dudes."
65,181754,Filter exclude utah from results,Chris,"26 Apr, 2021",yesterday,0,24,"I've wished this was a feature for years: a filter to exclude Utah from the search location settings. Dating for members outside of Utah, even being a member outside of Utah, can be very different than being a member actually in Utah. And that's a preference that, at least for me, I'm very interested in. When I do an anywhere search, I get tired of seeing all the Utah results (makes sense, largest demographic). However, the outside Utah people, in the US and rest of the world, I find I actually make contact with more often & enjoy talking to much more. It's just a demographic difference. Even offline, members outside of Utah tend to enjoy connecting more, we can drive an hour easy just to gather & hang out for an afternoon. It's a bit more exciting because we're used to being so few. Without this option, the generic anywhere setting still results in the majority of people shown being Utah people."
66,192616,Add a blind dating feature for people who dont want looks to influence if they m,Chad,"19 Jun, 2021",08 Jul,5,22,
67,198340,Filter body type,Stephanie,"17 Jul, 2021",07 Jul,3,22,There was an option for this on ldssingles and many other dating apps. Body types can be something like this: SlimAthleticAbout AverageA Few Extra PoundsCurvyOverweight
68,189478,Get rid of spamfraudulent users,Chele,"07 Jun, 2021",09 Jul,10,21,There is more spam on this account than any other... I have been asked for money at least 5 times.
69,175614,Downvote option on the feedback site,Jared,"31 Mar, 2021",yesterday,5,21,"We should have a downvote option on the feedback site. There are many topics, for instance, NCMO's, that the vast majority are opposed to but which would show an abnormal number of likes if they were posted. This bias is introduced because the parties in favor of said topic are more fanatical than the mainstream party. Feeling a strong connection to it means they upvote. It takes too long for some people to add a comment against a topic and they feel that they would be drowned out by many other comments anyway if they were to post (especially after seeing the many upvotes for that topic).  Downvotes would resove this problem and allow a bigger picture for support or opposition to a topic. At the end of the day, this isn't a democracy anyway; Mutual will decide what policies and practices they adopt on their own. I think downvoting is a necessary part of feedback."
70,170258,Web browser support,Q,"16 Mar, 2021",16 May,10,20,I am a software engineer and can help implement this
71,165226,Facebook mutual friends,Ashlee,"02 Mar, 2021",07 Jul,3,19,Ability to see mutual friends on Facebook so I know who to contact to set me up!
72,176263,Reset all swipes option,Ryan,"04 Apr, 2021",09 Jul,1,19,"The current refresh oldest 100 thing is very glitchy right now. I click it, but nothing happens unless I change my search parameters. Go back to what we had before."
73,181384,Photo age,Joseph Smith,"23 Apr, 2021",2 days ago,2,18,A date stamp (can be approximate) that tells how old photos are
74,173621,Translate messages,Giovanna,"25 Mar, 2021",07 Jul,7,17,Many times there are people who know each other but cannot speak due to the language difference.
75,169247,Fix ig integration,Anonymous,"13 Mar, 2021",yesterday,2,17,Ig photos are zoomed in when expanded and there is no way to scroll the image
76,164972,World wide distance,Cole,"02 Mar, 2021",03 Jul,2,17,"If I choose to look at everyone world wide, it would be nice to have an option where the distance starts out close to my area then slowly expands outward"
77,173851,Limit new matches based on how often you respond to the ones you already have,Josh,"26 Mar, 2021",2 days ago,0,17,"If you want to keep matching/swiping, you should either delete older matches that you've lost interest in, or respond to matches you already have. People would be way less likely to swipe up on people they would ghost, and they may even find love with an old match. It's a good way of encouraging people to seriously investigate people, or at least not waste other people's time. It would also make the ""see who likes me"" feature more appealing since people would want to make the best use of their limited match space.I'd be more interested in a person if I knew they had limited storage and used some on me. Someone with full storage could still come up on other people's feed,  but their feed would say ""You've been talking to 2 out of your 30 matches in the last week.  Reach out to some before you keep matching""People who regularly respond wouldn't have that issue or would at least have more storage. Potentially another premium feature.  50 matches instead of 30. Thank you"
78,188769,Filter returned missionary,Matthew S. Mahoney,"03 Jun, 2021",today,11,16,
79,194118,Add education level,Holly,"26 Jun, 2021",today,3,16,"As someone with a masters degree who makes Clos to 6 figures, I don't want someone who has been working at Walmart since high school. I want an equal. Education is important to me, I also want it to be important to my partner.  It could be a drop down with options: (high school, tech school, some college, bachelor's, graduate degree)"
80,165321,Minimum character count in bio,Qaseem Maajid-Bey,"02 Mar, 2021",09 Jul,2,16,Have a minimum character count in the bio to encourage people to talk about themselves and increase interest.
81,172209,Home screen should be messaging,Dan,"21 Mar, 2021",22 May,0,16,Home Screen should be messaging not back to more profiles. This will allow us to focus on our matches and not on just swiping.
82,199535,Fix photo sizing,Kyra,"26 Jul, 2021",today,4,15,"Sometimes when I try to add a photo that isn't the exact size it needs it to be, I have to resize it or screenshot it. Some of them turn out blurry or sized weird"
83,192610,Add a section asking about covid vaccination status,Chad,"19 Jun, 2021",yesterday,4,15,
84,179087,Add more then 2 letters for the state or country better geographic clarity pleas,James McLean,"14 Apr, 2021",yesterday,0,15,"As a global app, 2 letters is just not enough to clearly identify the location. What does CA mean? Cambodia, Canada, California'?. 2 letters are not enough, especially when you're not even consistent with whether it is a state or country. If it is a state then add the country. Better yet, you could use a small pic of the country's flag. That would save screen space and add character to the app."
85,175897,Publish dating market statistics for an area,Trent,"02 Apr, 2021",09 Jul,0,15,"Or sell them, if mutual needs the money. Basically the app has a lot of interesting data already (how many lds people are dating in X city, how many swipes result in a match, how many matches result in a two way message, what portion of users are male/female in a given area, how many people does it take to get a match on average, etc).  YSA move around a lot and it would be very helpful and valuable to have an idea for these sorts of things ('oh, the job offer in Chicago has 200 mutual users in the area, but the offer in DC has 600, good to know'). I bet plenty of users would pay $10+ for a detailed report and it would cost very little to produce since the app already knows it's user base.  More personalized reports like 'X percent of people swipe up on this photo, Y percent on this other photo' or even 'of 1000 male profiles in the area, users swipe on you more than they do on 550 of the others' etc would also be interesting. The user base generates the data, let them see it."
86,173770,Party room,Braeden,"25 Mar, 2021",09 Jul,0,15,"(This tries to mirror connecting with people at a party)  Display the first profile pic of 6 different people side by side. The user taps 2 of those people to ""get to know better"". The other 4 people go away, and the user sees those 2 people's whole profile.  They swipe up or down, then 6 new people come up, in the same process.  The 4 people they did not choose do not show up again for 1 week (or maybe 24 hours), after which they will come back around in the rotation.  (This adds a fun element of decision, sort of like at a party where you have a limited amount of time to spend talking to people) Might be a fun twist!"
