,id,suggestion,author,date_created,last_upvoted,comments,votes,Description
87,164969,Scroll bar,Cole,"02 Mar, 2021",03 Jul,0,15,"Make the distance bar not a slide bar, but instead one of those scroll wheel things. The slide bar is too inconvenient for thousands of miles to be on"
88,179930,Timedate stamp on messages,Howie,"18 Apr, 2021",09 Jul,1,14,Time/date stamp on messages
89,186715,Allow those who you have liked to see you liked them,Anonymous,"21 May, 2021",09 Jul,2,13,"When people pay for the membership on the app, it should allow people who you swipe up on be able to see that you want to connect with them. Otherwise I feel like you have just as much of a chance of finding a connection as someone who doesn't pay for the app."
90,194685,See at least 1 person per week,Micah Conover,"29 Jun, 2021",2 days ago,0,13,"I think it would be nice to get to see at least 1 person who likes me per week for free. That wouldn't get rid of the incentive to pay to see the 99+ people who like me, but it would make it so I could match a little more easily. Sometimes it's discouraging to swipe for a long while, and exit the app without any luck. Being able to see someone who likes me each week, would at least insure that I come across something that could be mutual, once in a while."
91,192772,Be able to set your location to your home city while traveling,Jacob Coleman,"19 Jun, 2021",09 Jul,0,13,It would be great to be able to still have your location be your home location while traveling. This way you can still find singles within reasonable distance while traveling and not feel like the app is completely useless because it's you can only look at singles in your vacation location.
92,173521,Questionnaire,Jared,"25 Mar, 2021",09 Jul,0,13,"Everyone can answer the questions they're comfortable with and then you can check a match's answers to the questions that you've answered yourself. In order to see the answers to questions that you haven't taken, you have to answer the corresponding question (to prevent ppl from saying what a match wants to hear). To prevent addictive behavior and to reward consistent app use, there could be a limit to the number of questions that can be answered per day (e.g. 10 questions). Maybe this wouldn't apply to answering questions a match had answered (while looking at a match). Premium users could then see a match % based on the questions and interest tags"
93,196148,Filter unwanted names,Anne Lester,"06 Jul, 2021",today,6,12,Add a filter to block certain names. Nobody wants to date their dad.
94,176295,Metric vs imperial on height,Anonymous,"04 Apr, 2021",07 Jul,3,12,"Please change Canada to feet and inches. Sure we use centimetres here in the great white North, but not when regarding height. This is honestly the worst. Please change this."
95,200637,Give stats on your profile percentageswhats successful,Todd,"29 Jul, 2021",09 Jul,2,12,1. How much time people spend on your profile2. Which picture they swipe up on (how many they look through)/or a percentage of how many people get how far into your pictures3. How many read your profile4. How many view it vs swipe on it5. How many use the second look option
96,282931,Family tree app linked to this,Hailey,26 Feb,09 Jul,1,12,"I have had a 2nd cousin swipe up and communicate with multiple girls he's related to. Not me, but 2 of my cousins. They found this out at a family funeral and as you can imagine, it was quite funny/awkward. Since there are no last names, I think the family tree app that says how closely you're related would be helpful hahah."
97,201410,Rollover notes,Barry,"03 Aug, 2021",09 Jul,1,12,"It's the same concept as rollover minutes, but for notes!  So, let's say I have 1 note on day 1, but I do not use it.  On day 2 I will have 2 notes to use!  If I don't use either of those notes on day 2, I will end up with 3 notes on day 3, and so on!"
98,198341,Filter gym activity,Shelby,"17 Jul, 2021",08 Jun,1,12,"Have an option to display and filter level of days/hours at gym every week.Options could be something like this: Days per week: 1, 2, 3... etcHours per week: 1, 2, 3... etc"
99,173095,Multiple search locations,Frank the Dog from Men In Black 2,"23 Mar, 2021",07 Jul,1,12,"Setting multiple search locations, maybe up to five or so, instead of setting a distance meter."
100,202149,React to messages sent,Kristina Cannon,"09 Aug, 2021",09 Jul,0,12,"An awesome feature would be to mirror iphone messages/instagram dms with how you can react to messages sent to you. I love being able to heart a message, emphasize a message etc. I just had the thought to maybe add another feature where you can reply to specific messages like you can imessage."
101,176239,Pause profile,Amanda,"04 Apr, 2021",03 Jul,0,12,It would be cool if we could pause our accounts for a while if we don't want to deactivate it but we also aren't wanting to show up on other people's profiles or anything.
102,175898,Option for more detailed profile info,Trent,"02 Apr, 2021",07 Jul,0,12,"Allow users to create a 'bonus' profile with more personal information about what they want in life, what they're into, what they care abt in a partner etc that they can grant access to after matching or after going out w another user and having a good time.  Profiles (and first dates) tend to be intentionally light hearted and nobody wants to ask 'how many kids do you want to have' or 'are you/have you been a pornography user' or 'what sort of income/spending level do you expect to have' or 'what is something that you find attractive/unattractive in a partner' or 'if your spouse left the church do you think you'd be more likely to break up, or to leave the church yourself' etc etc.  Basically it would be like a 'level 2' profile that you share selectively w someone once you've built some trust or connection. Nobody wants to go into date one or two throwing those topics on the table at a restaurant but many people are interested in them for compatibility."
103,177626,Repeal height filter,Aaron,"09 Apr, 2021",08 Jul,8,11,This encourages the stigma of rejecting someone based on their height. A genetic predisposition that cannot be changed.
104,186181,Optional profile feedback,Jeremy,"18 May, 2021",yesterday,4,11,"Instead of swiping down, the user could have the option to provide constructive feedback on a profile by choosing from a list of common profile mistakes or sending an anonymous message.  Examples:Too many people in photosUnflattering photosInappropriate photosGeneric descriptionSpelling and grammarBio is negative, disrespectful, immature, boring, too brief, inappropriateToo few or too many interests User could select all that apply. Receiving feedback could be opt-in only. Feedback could also be in the form of an anonymous message but would probably be abused. Inappropriate messages could be reported."
105,202557,Message preview in notification,Sterling,"10 Aug, 2021",09 Jul,2,11,"I want the notification on my phone to have the message they sent displayed, just like every other messages app I've ever used. I am fairly confident this will significantly reduce people unintentionally ghosting each other and generally help response times. This is the norm for messaging across the boards on smartphones, and would be very useful here. Every app also has a setting to disable it, which y'all could also throw in there pretty easily"
106,186677,Date ideas,Nathaniel Sparks,"20 May, 2021",yesterday,2,11,Have a list of common date ideas and select ones you like. When you match with someone you can see common date ideas you like
107,211694,Reset all downswipes from people who like you,Tyler Alley,"05 Sep, 2021",yesterday,1,11,In addition to the current feature of reset the oldest 100. The reset all swipes could be a 3rd reset option
108,188116,Get rid of say hi,J,"31 May, 2021",08 Jul,1,11,"In addition to the suggestion for conversation prompts... it would be amazing to replace the 'say hi' prompt that comes up after a match, because that is quite often the ONLY thing that people say... and I had to stop getting mad when I realized that people are just doing what the app told them to do :P"
109,193363,Reasons for swiping,Holly,"23 Jun, 2021",2 days ago,0,11,"When you match or don't match with someone, have a selection option for why you swiped the way you did. Then mutual could maybe filter so similar people show up more often. These could also just let mutual know what things we swipe based on. Even if it's every few swipes instead of every one..."
110,189884,Verified profiles filter for them,Jeramy,"08 Jun, 2021",09 Jul,6,10,"I'm tired of getting fake profiles matching who have little to no bio, rarely any info that checks out, and upon further inspection after matching the 3 photos they uploaded are of three separate women that were ripped off Insta or random online searches. Verified Profiles and a way to search only those verified would be wonderful!"
111,266157,The new about me section is too short,Liz,"27 Dec, 2021",09 Jul,4,10,"The old section was much better. I really felt like I could learn a bit about a person. This is way too short now! Other sites like Hinge and Bumble include a lot more info in your stats section (kids status, politics etc) so they don't need as much room in the About Me section but this is ridiculously short!!"
112,189906,Make the distance slider better,Ryan,"08 Jun, 2021",2 days ago,3,10,The distance slider should be exponential. The most useful range is 0-40 miles anyway so instead of that being 4mm long on the slider it should take up half of the slider.
113,187180,Purge users,Bparks,"25 May, 2021",07 Jul,0,10,"I get the feeling that a lot of the people on the app are married or don't use it. In other words, it feels like the swiping is bloated based off of false profiles. Maybe consider purging users who have been inactive for a couple of years."
114,186991,Check to mark your divorce is finalized,A,"23 May, 2021",2 days ago,0,10,"I've come across so many guys where they are still married. It's in the fine print your divorce needs to be finalized, but you need to make them actually check a box to move on the next page of setting up their profile. It needs to be in their face"
115,173511,No gun photos,Lj,"24 Mar, 2021",07 Jul,16,9,Ban gun pictures
116,186730,Reviews would be fun,j the Zuni,"21 May, 2021",11 Jun,9,9,Submit a review/rating after a date for the other persons approval-The reviews show up in the bio
117,174229,Social media section,Khiler,"27 Mar, 2021",05 Jan,5,9,A separate section to either link or add their social media profiles so then people dont just put their Instagram handle in their bio and call it good. Helps push creativity in bio.
118,200613,No dead animals,Kelsi,"28 Jul, 2021",2 days ago,2,9,"I'm so sick of seeing dead deer, elk, fish, etc. on guys' profiles. There are other photos someone can upload to indicate they enjoy hunting and/or fishing, but nobody needs to see the actual dead animal."
119,184715,Show which chats you havent replied to,Alex,"11 May, 2021",07 Jul,1,9,Matches seem to come in waves and sometimes its easy to miss or forget to reply to a message when there's a bunch at once. In other apps there's an icon in your list of chats showing which convos are 'your turn' to reply. This makes it a lot easier to not miss a message and or remember to reply if you checked it while busy.
120,307193,Lower subscription price,Bay,11 Jun,yesterday,0,9,Self explanatory ^ This app is mostly made up of high school/college students.  This app is way too expensive.
121,225427,Clarify interested in,N.,"18 Oct, 2021",09 Jul,0,9,"Instead of ""up for dancing"" or similar, create 4 horizontal categories: 1. Seeking friends, 2. Casual dates, 3. Serious dates, 4. Ready for a relationship/marriage. Within those categories, add a vertical slider to choose your sub-group, to have more fun language. The current ice cream, dancing, and looking for fun tags are somewhat nebulous"
122,217248,Unmatch feedback,R,"22 Sep, 2021",09 Jul,0,9,"Have the reason they unmatch be shown to the person they unmatch with. Whether it's ""not messaging enough"" or ""no chemistry"" etc."
123,210998,Superlike feature,alberthallingtonianianan,"31 Aug, 2021",2 days ago,0,9,"It can be difficult to tell if a swipe means anything coming from another party. It could mean they're actually interested, or it could (and only too often does) mean absolutely nothing at all. It would be appropriate to have some sort of ""superlike"" feature that would allow you to do one of two things: 1 - ""superlike"" a profile as you're casually swiping. This could be some sort of button or whatever, similar to how you would send a note... but not necessarily needing to send a message.  2 - provided you have already matched with someone, you could ""upgrade"" your ""like"" to a ""superlike"" and thus let the other person know you're ACTUALLY INTERESTED.  This simple feature would eliminate a great deal of confusion."
124,164959,Tagging the other people in the photo,Alex,"02 Mar, 2021",08 Jul,0,9,Sometimes I wanna know who the other cutie is... so if they like tagged their profile or insta that would be great
125,187103,Reverify people regularly,Isabella,"24 May, 2021",03 Jul,1,8,"Its easy to get verified and then change your pictures after, maybe reverifying people every few months or something to help maintain peoples integrity and keep people on the app safe:)"
126,198728,Read receipt for notes,Jeff,"20 Jul, 2021",2 days ago,0,8,Show when your note has been read.
127,185701,Ward hopping,Lindsay,"16 May, 2021",07 Jul,0,8,Have the choice to block those ward hopping if you're not interested in those outside your seeking radius.
128,190597,Filter by region,Matt,"10 Jun, 2021",04 Jun,12,7,Sometimes if I have my search distance to worldwide I only see people from certain regions that I may not want to co sider moving to. It would be nice to be able to filter those out
129,194489,Filter modesty,Mitch,"29 Jun, 2021",08 Jul,5,7,"Be able to filter out anyone who is wearing immodest clothing (bikini, shirtless, etc.) in their profile pictures. The community guidelines don't have high enough standards for some people, and this will make it more friendly to those who are not satisfied with the lax standards."
130,214101,Hair and eye color filter,Joe,"14 Sep, 2021",09 Jul,3,7,"Filter potential spouse by hair and eye color. Many people are looking for someone with particular traits like blond hair, blue eyes etc. For those people it would make the app more effective by incorporating this feature. Similar idea to height filter."
131,185111,Healthy fitness level filter,Anonymous,"13 May, 2021",11 Jun,3,7,"Have the ability to filter and not get flooded with people who don't workout when it's super important to you is key in compatibility. Most dating apps have an option to filter on either activity level, # of times they workout a week, etc any of those would do '?"
132,169315,Picture suggestions,Jake,"14 Mar, 2021","26 Jul, 2021",3,7,"Its rough when someone adds a picture and they have a facemask, are with 3 other people, it's their dog, or otherwise don't show themselves at all. I have no idea what they look like when they do that.  When creating your account maybe have suggestions for adding pictures and maybe an AI to detect if the picture ""doesn't show you very well"" doesn't have to block the picture just.. suggest an edit."
133,222916,Another ui overhaul,Ammon,"09 Oct, 2021",03 Jul,2,7,"The latest UI update that changed the majority of the app interface is just bad. The change in font, the positioning of names/locations, and the massive menu bar at the bottom makes it feel like an app from 2012, not 2021. The old design was SO clean and easy to use, I can't understand what possessed the team to make such drastic changes for the worse. In its current state, I have a hard time spending any time in the app because it feels so stunted and clunky. My suggestion in one sentence: Revert the UI back to the old version or spend more time making it better."
134,190987,Account vacationtake a break mode,Adam Proctor,"13 Jun, 2021","17 Dec, 2021",2,7,You can set your account to take a break beachside you need some time away but don't want to delete or leave it live and do am major clean up. This is so you don't need to delete the account and you would not come back to matches that that may have been around and the user think you did not
135,169853,I dont like you,Alec,"15 Mar, 2021",07 Jul,2,7,When you're swiping down on someone in the normal queue they're immediately taken out of the see who liked you queue
136,232162,More info snippets,Sid,"12 Nov, 2021",09 Jul,1,7,"Something I really appreciate in the Hinge App, that I would also love to see in Mutual, would be a section/scrollbar for more quick snippets of info.  In Hinge, they have a little 'optional' section that includes quick, possibly deal-breaker info  with cute, easy icons included, like, 'has kids', 'wants kids', 'drinks sometimes', 'never smokes', etc. I would appreciate adding even more on Mutual than what Hinge has like, 'is ok with cussing' or other more culturally-specific tid-bits."
137,196166,Change location,Chantelle,"06 Jul, 2021",27 May,1,7,Be able to change my location if I know I'm moving soon to be in that area instead of where I'm at currently. Or change it to home if I'm traveling.
138,183681,Hide me from certain names,Halsey W,"06 May, 2021",08 Jul,1,7,"A filter option to hide your profile from certain first names (stalkers, exs, people you'd rather not come across again)"
139,284319,Inability to screenshot,Lily,06 Mar,2 days ago,0,7,"A privacy feature, like so many streaming services have, that doesn't allow/causes a blacked-out screen for screenshots would allay reservations some users might have about creating an account."
140,223698,Be notified when a match decides to say goodbye,DJ,"11 Oct, 2021",07 Jul,0,7,"Recently I received a notification saying someone messaged me. But when I went in to messages that person was deleted from my message page. I can only assume he decided he wasn't interested, and unmatched me. It would be nice if the app notified you of this."
141,211333,Liked image,Payton,"02 Sep, 2021",09 Jul,0,7,"When matched with, see which image they swiped up on. And/or which image is most swiped on."
142,201202,Premium lite,Josh,"02 Aug, 2021",17 Feb,0,7,"Different subscription ""plans"" for mutualUp that are more affordable and have fewer features. For example, Premium Lite could give users access to a couple things like just the height filter and additional notes."
143,192814,Remove unnecessary notifications,Mac,"19 Jun, 2021",01 May,0,7,"Stop telling me ""your next adventure is just a swipe away"" or whatever. Your random notifications are annoying and unnecesaary"
144,201800,Add a lifetime membership option,T,"05 Aug, 2021",30 Jun,3,6,Please consider adding a lifetime membership option to the service. Other apps already have this capability and Mutual could benefit from this feature.
145,175219,Down to chat toggle,Jairon Terrero,"30 Mar, 2021",07 Jul,3,6,"Even if I swipe down on someone, I'm still more than happy to chat, exchange memes, and make friends that person. Similarly, I would love to just make friends with the people that I don't match with (regardless of which of us doesn't swipe up). I think making a dynamic that allows people to get to know each other without any expectations about having to go on a date or make a relationship would make the process more natural and appealing to everyone. As such, it would be cool to be able to toggle a feature that lets anyone say hi to me (or me to them if they have it enabled). I realize this is an awful lot like sending notes, but I feel like sending notes just seems act of desperation haha so I never do it. All in all, it would be great if the platform could be used to meet friends rather than only bringing together people who both find each other attractive."
146,210999,Match guide,alberthallingtonianianan,"31 Aug, 2021",07 Jul,2,6,"This is a feature that facebook dating has and that I think would do absolutely wonderful on mutual. You should be able to (and even be encouraged to) fill out a voluntary ""match guide"" that would give your potential matches some sort of idea what you expect. Some people handle sarcasm really well, others not so much. Some people want a funny, cheesy, sarcastic pickup line, while other people think those are dumb and would prefer you to be direct.  A short ""match guide"" that users fill out and that would be displayed once you match with someone would really help both parties understand what the other is expecting and would likely lead to better conversations, more engagement, and thus more success, more refferals to mutual, more time spent on the app, more ad impressions, more mutualUp users, etc.  Beneficial to all parties involved."
147,205322,Matchmaking mode,David,"28 Aug, 2021",11 Jun,2,6,Youre shown two random profiles and you get to decide if you think they seem like a good match. Recommendations are sent to people based on who others have matched them with. You get trophies or something if you set up a successful match
148,200820,Edit sent notes,Sarah Campbell,"30 Jul, 2021",03 Jul,2,6,The ability to either erase or change notes you've sent in the past. Profiles will show up in your swipes again!
149,189876,Mix in people that like me,TJ,"08 Jun, 2021",2 days ago,2,6,I've been swiping through people for hours and the number of people that like me still hasn't changed up or down. I don't want to pay to see exactly who likes me. Please mix them in with all the other people. This seems like the opposite of what this app is supposed to do.
150,196140,Sort matches by distance,Ddport,"06 Jul, 2021",07 Jul,1,6,I would like to sort Matches by Distance. See who is local.
151,188118,More profile prompts,J,"31 May, 2021",27 May,1,6,It can help people start a profile (and can help in starting a conversation) if people can list answers to multiple profile prompts/questions to answer about themselves rather than just one message box that says 'say something about yourself' or 'would you rather skydive or shark dive'.
152,165097,Filter instagram profile,Leonard,"02 Mar, 2021","31 Jul, 2021",1,6,I have seen many profiles that takes advantage of the app to raise their Instagram profile followers.
153,205697,Dont erase chats,Mike,"29 Aug, 2021",2 days ago,0,6,Please don't erase chat conversations after a matter of weeks.  Please consider leaving them up permanently or at least 4-6 months.
154,203302,Unblock,Keith,"16 Aug, 2021",07 Jul,0,6,How do I see who I have blocked and maybe even unblock them?
155,200935,Link friends mutual profiles to one another for easy browsing,Sam,"31 Jul, 2021",2 days ago,0,6,"If someone likes me then chances are they'll also like my friends since we have similar interests and lifestyles. It would be an ""if you liked this person chances are you'll also like this person"" sort of feature."
156,195253,Pause locations,Josh,"02 Jul, 2021",03 Jul,0,6,"I think it'd be great to pause your location for when you go on short trips. That way you can still be active but not have your location change because you're away for the weekend. In situations where it's a longer trip, i.e. more than a week or two, users should probably pause their profile or just not use Mutual for the time being."
157,190895,Refresh messages within the messages page,Brett,"12 Jun, 2021",03 Jul,0,6,Being able to swipe down from the top of the messages page to refresh messages. Right now I have to go in and out of the page to do so.
158,188240,X miles away,Madeleine,"01 Jun, 2021",03 Jul,3,5,"We have our distance filters, but some live in areas with very few members and must set the distance filter to 100, 200, or 250 miles for enough variety/choices.  It would be nice to see an exact distance with a given match so you don't have to google their location to see how difficult it would be to actually meet up in person."
159,281412,Force users to complete verification,Michael,20 Feb,09 Jul,1,5,"Users should be forced complete verification before they can show up in the matchmaker. This requirement should be considered essential for the safety of users. Aside from that, it helps prevent bot accounts from wasting our time."
160,253900,Background check every profile claim,Joel,"04 Dec, 2021",25 May,1,5,"Every attribute on a profile should have a background check process behind it to confirm it. Examples of important profile claims that should be verified by a background check service includes: martial status, children, income, credit score, job history, education, and criminal record. The results of a medical checkup would confirm height, weight, drug/substance usage, and fitness level."
161,211582,See who took a screenshot,Shei,"04 Sep, 2021",08 Jul,1,5,
162,194908,Let me change my name,Jessica/Jessie,"01 Jul, 2021","06 Dec, 2021",1,5,"I wish I could change my name to my nickname. I even changed it on Facebook which is where my profile initiated from, but it did not change it on my profile. It is very frustrating."
163,188038,Change ux to incorporate text and pictures,Joshua,"30 May, 2021","04 Sep, 2021",1,5,"Instead of tapping to see more about a person, you swiping left and right should alternate between pictures and text. For example:Screen 1 PhotoScreen 2 Name, location, about me blurbScreen 3 PhotoScreen 4 Work, education, mission Screen 5 photoScreen 6 small blurb like favorite first date, thing I couldn't live without, etc (like a random tidbit fact)Screen 7 photo Screen 8 small blurb again (but different) like favorite first date, thing I couldn't live without, etc (like a random tidbit fact)Screen 9 Photo Screen 10 instagram, Spotify"
